{
  "$schema": "https://json-schema.org/draft/2020-12/schema",
  "$id": "https://editflow.local/schema/gpt-orchestration-assignment-v1.json",
  "title": "EditFlow GPT Orchestration Assignment V1",
  "type": "object",
  "additionalProperties": false,
  "required": [
    "schema",
    "assignmentId",
    "sessionId",
    "mode",
    "editTypeId",
    "status",
    "finish",
    "start",
    "practicePolicy",
    "artifactDir",
    "chatMessage",
    "createdAt",
    "claimedAt",
    "claimedBy",
    "startedAt",
    "completedAt",
    "cancelRequestedAt",
    "finalRenderRef",
    "finalSummary",
    "error"
  ],
  "properties": {
    "schema": {
      "const": "editflow.gpt-orchestration-assignment.v1"
    },
    "assignmentId": {
      "type": "string",
      "minLength": 1
    },
    "sessionId": {
      "type": "string",
      "minLength": 1
    },
    "mode": {
      "enum": [
        "PRACTICE",
        "PRO_CREATION"
      ]
    },
    "editTypeId": {
      "type": "string",
      "minLength": 1
    },
    "status": {
      "enum": [
        "PENDING",
        "CLAIMED",
        "RUNNING",
        "CANCEL_REQUESTED",
        "CANCELLED",
        "COMPLETED",
        "FAILED"
      ]
    },
    "finish": {
      "anyOf": [
        {
          "$ref": "#/$defs/media"
        },
        {
          "type": "null"
        }
      ]
    },
    "start": {
      "type": "array",
      "minItems": 1,
      "items": {
        "$ref": "#/$defs/media"
      }
    },
    "practicePolicy": {
      "anyOf": [
        {
          "$ref": "#/$defs/practicePolicy"
        },
        {
          "type": "null"
        }
      ]
    },
    "artifactDir": {
      "type": "string",
      "minLength": 1
    },
    "chatMessage": {
      "type": "string",
      "minLength": 1
    },
    "createdAt": {
      "type": "string",
      "format": "date-time"
    },
    "claimedAt": {
      "$ref": "#/$defs/nullableDate"
    },
    "claimedBy": {
      "$ref": "#/$defs/nullableString"
    },
    "startedAt": {
      "$ref": "#/$defs/nullableDate"
    },
    "completedAt": {
      "$ref": "#/$defs/nullableDate"
    },
    "cancelRequestedAt": {
      "$ref": "#/$defs/nullableDate"
    },
    "finalRenderRef": {
      "$ref": "#/$defs/nullableString"
    },
    "finalSummary": {
      "$ref": "#/$defs/nullableString"
    },
    "error": {
      "$ref": "#/$defs/nullableString"
    },
    "practiceRole": {
      "enum": [
        "LEARNING",
        "HELD_OUT_CERTIFICATION",
        null
      ]
    },
    "practiceSceneMatches": {
      "anyOf": [
        {
          "type": "array",
          "items": {
            "type": "object"
          }
        },
        {
          "type": "null"
        }
      ]
    },
    "preflight": {
      "$ref": "#/$defs/preflight"
    },
    "controllerLease": {
      "anyOf": [
        {
          "$ref": "#/$defs/controllerLease"
        },
        {
          "type": "null"
        }
      ]
    }
  },
  "$defs": {
    "practicePolicy": {
      "type": "object",
      "additionalProperties": false,
      "required": [
        "minimumSimilarity",
        "exactSceneConfidence",
        "minimumAudioConfidence"
      ],
      "properties": {
        "minimumSimilarity": {
          "type": "number",
          "minimum": 0.95,
          "maximum": 1
        },
        "exactSceneConfidence": {
          "type": "number",
          "minimum": 0.95,
          "maximum": 1
        },
        "minimumAudioConfidence": {
          "type": "number",
          "minimum": 0.9,
          "maximum": 1
        }
      }
    },
    "nullableString": {
      "anyOf": [
        {
          "type": "string",
          "minLength": 1
        },
        {
          "type": "null"
        }
      ]
    },
    "nullableDate": {
      "anyOf": [
        {
          "type": "string",
          "format": "date-time"
        },
        {
          "type": "null"
        }
      ]
    },
    "media": {
      "type": "object",
      "additionalProperties": false,
      "required": [
        "mediaId",
        "role",
        "mediaKind",
        "uri"
      ],
      "properties": {
        "mediaId": {
          "type": "string",
          "minLength": 1
        },
        "role": {
          "enum": [
            "FINISH_REFERENCE",
            "START_SOURCE"
          ]
        },
        "mediaKind": {
          "enum": [
            "VIDEO",
            "AUDIO"
          ]
        },
        "uri": {
          "type": "string",
          "minLength": 1
        },
        "checksum": {
          "type": "string"
        },
        "durationMs": {
          "type": "number",
          "exclusiveMinimum": 0
        }
      }
    },
    "preflight": {
      "type": "object",
      "additionalProperties": false,
      "required": [
        "stage",
        "updatedAt",
        "requireTransferNovelty",
        "completedShotIds",
        "unresolvedShotIds",
        "reasons",
        "evidenceRefs"
      ],
      "properties": {
        "stage": {
          "enum": [
            "PREFLIGHT_MATCHING",
            "FINGERPRINTING",
            "REFERENCE_ANALYSIS",
            "SOURCE_INDEXING",
            "SCENE_MATCHING",
            "AWAITING_CHATGPT_SHOTS",
            "AWAITING_CHATGPT_REFERENCE",
            "TARGETED_REFINEMENT",
            "WORKING_MEDIA",
            "BLOCKED",
            "READY"
          ]
        },
        "updatedAt": {
          "type": "string",
          "format": "date-time"
        },
        "requireTransferNovelty": {
          "type": "boolean"
        },
        "totalShotIds": {
          "type": "array",
          "items": {
            "type": "string",
            "minLength": 1
          },
          "uniqueItems": true
        },
        "completedShotIds": {
          "type": "array",
          "items": {
            "type": "string",
            "minLength": 1
          },
          "uniqueItems": true
        },
        "unresolvedShotIds": {
          "type": "array",
          "items": {
            "type": "string",
            "minLength": 1
          },
          "uniqueItems": true
        },
        "reasons": {
          "type": "array",
          "items": {
            "type": "string"
          }
        },
        "evidenceRefs": {
          "type": "array",
          "items": {
            "type": "string",
            "minLength": 1
          },
          "uniqueItems": true
        }
      }
    },
    "controllerLease": {
      "type": "object",
      "additionalProperties": false,
      "required": [
        "owner",
        "expiresAt"
      ],
      "properties": {
        "owner": {
          "type": "string",
          "minLength": 1
        },
        "expiresAt": {
          "type": "string",
          "format": "date-time"
        }
      }
    }
  }
}
