{
  "schema": "editflow.gpt-orchestration-assignment.v1",
  "assignmentId": "gpt-assignment:fixture",
  "sessionId": "practice:fixture",
  "mode": "PRACTICE",
  "editTypeId": "high-potency",
  "status": "RUNNING",
  "finish": {
    "mediaId": "finish:1",
    "role": "FINISH_REFERENCE",
    "mediaKind": "VIDEO",
    "uri": "C:/Media/finish.mp4"
  },
  "start": [
    {
      "mediaId": "video:1",
      "role": "START_SOURCE",
      "mediaKind": "VIDEO",
      "uri": "C:/Media/raw.mp4"
    }
  ],
  "practicePolicy": {
    "minimumSimilarity": 0.95,
    "exactSceneConfidence": 0.95,
    "minimumAudioConfidence": 0.9
  },
  "artifactDir": "C:/EditFlow/artifacts/practice-fixture",
  "chatMessage": "GPT controls EditFlow for this assignment.",
  "createdAt": "2026-09-22T20:00:00.000Z",
  "claimedAt": "2026-09-22T20:00:01.000Z",
  "claimedBy": "chatgpt-work",
  "startedAt": "2026-09-22T20:00:01.000Z",
  "completedAt": null,
  "cancelRequestedAt": null,
  "finalRenderRef": null,
  "finalSummary": null,
  "error": null,
  "preflight": {
    "stage": "SCENE_MATCHING",
    "updatedAt": "2026-09-29T23:00:00Z",
    "requireTransferNovelty": false,
    "totalShotIds": [
      "shot:1",
      "shot:2"
    ],
    "completedShotIds": [
      "shot:1"
    ],
    "unresolvedShotIds": [
      "shot:2"
    ],
    "reasons": [],
    "evidenceRefs": [
      "proof:shot:1"
    ]
  },
  "controllerLease": {
    "owner": "controller:1",
    "expiresAt": "2026-09-29T23:02:00Z"
  }
}
